{"bundle_digest":"sha256:46b8c20af10d229166619e3643742b42e6d2285f63566eade6978cae3d5282cc","bundle_id":"id:sha256:46b8c20af10d229166619e3643742b42e6d2285f63566eade6978cae3d5282cc","bundle_kind":"customer-proof","claims":[{"basis_refs":["id:sha256:7a923fcdb9e0af792216ff1d2cc916a7456d1998a2510f262ddb1aad20a84663","id:sha256:1b3fc1d4b75a2a5de1848e29a3606ae87ffc8b31e97d54de441df4d78aca629f"],"claim_id":"id:sha256:178e80b928614a26b58c35af69d77e01f917bbb85263ee1251106b050f0b8bfc","claim_type":"cost_reduction","claim_validity":"supported","scope":"matched_run","statement":"Treatment cost was lower than control for this matched run."},{"basis_refs":["id:sha256:3727e51ab3589bc71c1692738468d2cce5b64c081d305d3773d237d38d5011ba"],"claim_id":"id:sha256:528e6c9b4f275560ef2456e5ca68601b124e215c3494055187467cc30a670371","claim_type":"quality_preserved","claim_validity":"supported","scope":"matched_run","statement":"Treatment quality was preserved for this matched run."}],"created_at":"2026-08-22T09:00:00Z","inventory":{"item_count":13,"items":[{"availability":"present","digest":"sha256:7a923fcdb9e0af792216ff1d2cc916a7456d1998a2510f262ddb1aad20a84663","kind":"arm_receipt","path":"arms/control.json","redaction_class":"metadata_only","ref":"id:sha256:7a923fcdb9e0af792216ff1d2cc916a7456d1998a2510f262ddb1aad20a84663","size_bytes":1645},{"availability":"present","digest":"sha256:1b3fc1d4b75a2a5de1848e29a3606ae87ffc8b31e97d54de441df4d78aca629f","kind":"arm_receipt","path":"arms/treatment.json","redaction_class":"metadata_only","ref":"id:sha256:1b3fc1d4b75a2a5de1848e29a3606ae87ffc8b31e97d54de441df4d78aca629f","size_bytes":1655},{"availability":"present","digest":"sha256:3727e51ab3589bc71c1692738468d2cce5b64c081d305d3773d237d38d5011ba","kind":"quality_measurement","path":"quality/comparison.json","redaction_class":"metadata_only","ref":"id:sha256:3727e51ab3589bc71c1692738468d2cce5b64c081d305d3773d237d38d5011ba","size_bytes":38},{"availability":"present","digest":"sha256:5f6ba7e49bbba66d4a50d77214621315e1dae857fdda7325d57001d83b3b0e57","kind":"replay_input","path":"replay/input.json","redaction_class":"pseudonymized","ref":"id:sha256:5f6ba7e49bbba66d4a50d77214621315e1dae857fdda7325d57001d83b3b0e57","size_bytes":32},{"availability":"present","digest":"sha256:31d8054b86277b78587ad30f508797e1a74a144d425688d718b6af568fa4e719","kind":"replay_result","path":"replay/result.json","redaction_class":"metadata_only","ref":"id:sha256:31d8054b86277b78587ad30f508797e1a74a144d425688d718b6af568fa4e719","size_bytes":33},{"availability":"present","digest":"sha256:f4bac08cc4ca329f3794c7028825da7725d1c937e59274cb062bb1a750997ba9","kind":"run_metadata","path":"lineage/identity.json","redaction_class":"metadata_only","ref":"id:sha256:f4bac08cc4ca329f3794c7028825da7725d1c937e59274cb062bb1a750997ba9","size_bytes":15},{"availability":"present","digest":"sha256:ad93c7e4b8984e78029f85871fb74f464b8d67a2b3b8524c776652d65878a1a9","kind":"claim_basis","path":"lineage/policy.json","redaction_class":"metadata_only","ref":"id:sha256:ad93c7e4b8984e78029f85871fb74f464b8d67a2b3b8524c776652d65878a1a9","size_bytes":53},{"availability":"present","digest":"sha256:cb4a8b0255117537b92c89df015a026f5f0fdb35194461bfabd7ef7a9586def8","kind":"task_envelope","path":"lineage/control-task.json","redaction_class":"metadata_only","ref":"id:sha256:cb4a8b0255117537b92c89df015a026f5f0fdb35194461bfabd7ef7a9586def8","size_bytes":219},{"availability":"present","digest":"sha256:8f7fac4f96fbab78dae12e0402ebef2eb2e0b4fd264071f1f560058137f9bc75","kind":"execution_plan","path":"lineage/control-plan.json","redaction_class":"metadata_only","ref":"id:sha256:8f7fac4f96fbab78dae12e0402ebef2eb2e0b4fd264071f1f560058137f9bc75","size_bytes":422},{"availability":"present","digest":"sha256:574af9ee69a6374afab5103ae6df966361bf44a3bffb8920937dec1993395187","kind":"engine_invocation","path":"lineage/control-invocation.json","redaction_class":"metadata_only","ref":"id:sha256:574af9ee69a6374afab5103ae6df966361bf44a3bffb8920937dec1993395187","size_bytes":549},{"availability":"present","digest":"sha256:2458907b034c9ca4a5bd65abc9a312910a629a85d8a642933d7ef5439a08a7bb","kind":"task_envelope","path":"lineage/treatment-task.json","redaction_class":"metadata_only","ref":"id:sha256:2458907b034c9ca4a5bd65abc9a312910a629a85d8a642933d7ef5439a08a7bb","size_bytes":223},{"availability":"present","digest":"sha256:d0dc5bf0ec2dde319957a0d893265b274f86d151930216a83e7173668db3e3a4","kind":"execution_plan","path":"lineage/treatment-plan.json","redaction_class":"metadata_only","ref":"id:sha256:d0dc5bf0ec2dde319957a0d893265b274f86d151930216a83e7173668db3e3a4","size_bytes":426},{"availability":"present","digest":"sha256:ebb4eb1827bf3642287f790f76c8aa8ee3dab9c529b14876314cbf4dc529ddfb","kind":"engine_invocation","path":"lineage/treatment-invocation.json","redaction_class":"metadata_only","ref":"id:sha256:ebb4eb1827bf3642287f790f76c8aa8ee3dab9c529b14876314cbf4dc529ddfb","size_bytes":551}],"max_items":128,"total_bytes":5861},"limitations":{"known_limitations":["Provider response variability is outside the matched-run replay."],"unproven":["omission_before_capture","third_party_attestation","generalization_beyond_workload","production_sla"]},"matched_arms":{"control":{"arm_id":"id:sha256:660fb46674b8a16166026551e50b032a1ccf58a4d260c4bb4e42182350660830","evidence_refs":["id:sha256:7a923fcdb9e0af792216ff1d2cc916a7456d1998a2510f262ddb1aad20a84663"],"identity":{"endpoint_ref":"openai:direct","model":"gpt-5.6-luna","provider":"openai","source_commit":"git:6d4fefa595000000000000000000000000000000","workload_digest":"sha256:42d8afd8fea1184e1cb2a42075e602611597f2486636929f0a128fc907f489d5"},"measurements":{"cached_input_tokens":0,"cost":{"amount_micros":1000000,"currency":"USD","status":"observed"},"input_tokens":12000,"latency_ms":820,"output_tokens":900,"status":"observed"},"role":"control","status":"complete"},"match_basis":["provider","model","source_commit","workload_digest"],"match_id":"id:sha256:edcaf288f759371516be564ba8e346981a0ed7068581bb11d1da3fd38e585864","shared_identity":{"model":"gpt-5.6-luna","provider":"openai","source_commit":"git:6d4fefa595000000000000000000000000000000","workload_digest":"sha256:42d8afd8fea1184e1cb2a42075e602611597f2486636929f0a128fc907f489d5"},"treatment":{"arm_id":"id:sha256:b90873fbdffe04dad346c267e9dbdcf3c7a6f121e917620bc80a2531b78e4691","evidence_refs":["id:sha256:1b3fc1d4b75a2a5de1848e29a3606ae87ffc8b31e97d54de441df4d78aca629f"],"identity":{"endpoint_ref":"openai:proxy","model":"gpt-5.6-luna","provider":"openai","source_commit":"git:6d4fefa595000000000000000000000000000000","workload_digest":"sha256:42d8afd8fea1184e1cb2a42075e602611597f2486636929f0a128fc907f489d5"},"measurements":{"cached_input_tokens":4000,"cost":{"amount_micros":700000,"currency":"USD","status":"observed"},"input_tokens":8000,"latency_ms":790,"output_tokens":900,"status":"observed"},"role":"treatment","status":"complete"}},"quality":{"confidence":"high","control_score_milli":920,"evidence_refs":["id:sha256:3727e51ab3589bc71c1692738468d2cce5b64c081d305d3773d237d38d5011ba"],"method":"automated","metric":"score_milli","status":"preserved","treatment_score_milli":920},"redaction":{"class":"metadata_only","notes":"Outputs are omitted; bounded metadata and digests remain.","policy":"content_minimization","reversible":false},"replay":{"determinism":"same_inputs_expected","input_refs":["id:sha256:5f6ba7e49bbba66d4a50d77214621315e1dae857fdda7325d57001d83b3b0e57"],"mode":"offline","notes":"Replay covers the recorded workload inputs and comparison metadata.","result_refs":["id:sha256:31d8054b86277b78587ad30f508797e1a74a144d425688d718b6af568fa4e719"],"status":"partial"},"schema_version":"leanctx.customer-proof-evidence-bundle/v2","signing":{"algorithm":"Ed25519","key_id":"id:sha256:10ba682c8ad13513971e8b56881aab8bd702bb807796eca81932c735a94d6e6d","signature":"5x3C0D6GsQG358vkU98BSaGZGy2KZw3jqwFtlk1xyp6QmP0Xx9k6MwA8OEUNdNzP5jFe07qOLA20XLVvljQSAw==","signed_digest":"sha256:46b8c20af10d229166619e3643742b42e6d2285f63566eade6978cae3d5282cc","trust_basis":"out_of_band","trusted_signer_ref":"signer:id:sha256:10ba682c8ad13513971e8b56881aab8bd702bb807796eca81932c735a94d6e6d"},"status":"complete","subject":{"customer_ref":"customer:acme-labs","project_ref":"project:lean-ctx","workload_ref":"id:sha256:42d8afd8fea1184e1cb2a42075e602611597f2486636929f0a128fc907f489d5"}}