{"bundle_digest":"sha256:39103457d3258ef407b0e06cad31978b318fff97ed16ff12d7664130c5788005","bundle_id":"id:sha256:39103457d3258ef407b0e06cad31978b318fff97ed16ff12d7664130c5788005","bundle_kind":"customer-proof","claims":[{"basis_refs":["id:sha256:a120f431c3fd0df2aa13fea2c1fef16a0f53e7502ac32424d08c83de55801d0a","id:sha256:3268b39b4e6bb7c95f712d40a3ba857a644e51bce3367810a3bf5ebb76faf256"],"claim_id":"id:sha256:178e80b928614a26b58c35af69d77e01f917bbb85263ee1251106b050f0b8bfc","claim_type":"cost_reduction","claim_validity":"supported","scope":"matched_run","statement":"Treatment cost was lower than control for this matched run."},{"basis_refs":["id:sha256:a2f1f943b5f6c7f7b4f0ba6d1fec6e1134fc4f29bb9923cac2fadec8d79838a3"],"claim_id":"id:sha256:528e6c9b4f275560ef2456e5ca68601b124e215c3494055187467cc30a670371","claim_type":"quality_preserved","claim_validity":"supported","scope":"matched_run","statement":"Treatment quality was preserved for this matched run."}],"created_at":"2026-08-22T09:00:00Z","inventory":{"item_count":5,"items":[{"availability":"present","digest":"sha256:a120f431c3fd0df2aa13fea2c1fef16a0f53e7502ac32424d08c83de55801d0a","kind":"arm_receipt","path":"arms/control.json","redaction_class":"metadata_only","ref":"id:sha256:a120f431c3fd0df2aa13fea2c1fef16a0f53e7502ac32424d08c83de55801d0a","size_bytes":2048},{"availability":"present","digest":"sha256:3268b39b4e6bb7c95f712d40a3ba857a644e51bce3367810a3bf5ebb76faf256","kind":"arm_receipt","path":"arms/treatment.json","redaction_class":"metadata_only","ref":"id:sha256:3268b39b4e6bb7c95f712d40a3ba857a644e51bce3367810a3bf5ebb76faf256","size_bytes":2100},{"availability":"present","digest":"sha256:a2f1f943b5f6c7f7b4f0ba6d1fec6e1134fc4f29bb9923cac2fadec8d79838a3","kind":"quality_measurement","path":"quality/comparison.json","redaction_class":"metadata_only","ref":"id:sha256:a2f1f943b5f6c7f7b4f0ba6d1fec6e1134fc4f29bb9923cac2fadec8d79838a3","size_bytes":1024},{"availability":"present","digest":"sha256:9c8841eea94ae560ca549e5d514c003eb4e1349c748e6b85dc0725e6bee9363a","kind":"replay_input","path":"replay/input.json","redaction_class":"pseudonymized","ref":"id:sha256:9c8841eea94ae560ca549e5d514c003eb4e1349c748e6b85dc0725e6bee9363a","size_bytes":512},{"availability":"present","digest":"sha256:a9fb18a382eb328e79f067415aeabfcbf2a867dadc96bb6cf0fbb6bff0ddbe10","kind":"replay_result","path":"replay/result.json","redaction_class":"metadata_only","ref":"id:sha256:a9fb18a382eb328e79f067415aeabfcbf2a867dadc96bb6cf0fbb6bff0ddbe10","size_bytes":4096}],"max_items":128,"total_bytes":9780},"limitations":{"known_limitations":["Provider response variability is outside the matched-run replay."],"unproven":["omission_before_capture","third_party_attestation","generalization_beyond_workload","production_sla"]},"matched_arms":{"control":{"arm_id":"id:sha256:660fb46674b8a16166026551e50b032a1ccf58a4d260c4bb4e42182350660830","evidence_refs":["id:sha256:a120f431c3fd0df2aa13fea2c1fef16a0f53e7502ac32424d08c83de55801d0a"],"identity":{"endpoint_ref":"openai:direct","model":"gpt-5.6-luna","provider":"openai","source_commit":"git:6d4fefa595000000000000000000000000000000","workload_digest":"sha256:42d8afd8fea1184e1cb2a42075e602611597f2486636929f0a128fc907f489d5"},"measurements":{"cached_input_tokens":0,"cost":{"amount_micros":1000000,"currency":"USD","status":"observed"},"input_tokens":12000,"latency_ms":820,"output_tokens":900,"status":"observed"},"role":"control","status":"complete"},"match_basis":["provider","model","source_commit","workload_digest"],"match_id":"id:sha256:edcaf288f759371516be564ba8e346981a0ed7068581bb11d1da3fd38e585864","shared_identity":{"model":"gpt-5.6-luna","provider":"openai","source_commit":"git:6d4fefa595000000000000000000000000000000","workload_digest":"sha256:42d8afd8fea1184e1cb2a42075e602611597f2486636929f0a128fc907f489d5"},"treatment":{"arm_id":"id:sha256:b90873fbdffe04dad346c267e9dbdcf3c7a6f121e917620bc80a2531b78e4691","evidence_refs":["id:sha256:3268b39b4e6bb7c95f712d40a3ba857a644e51bce3367810a3bf5ebb76faf256"],"identity":{"endpoint_ref":"openai:proxy","model":"gpt-5.6-luna","provider":"openai","source_commit":"git:6d4fefa595000000000000000000000000000000","workload_digest":"sha256:42d8afd8fea1184e1cb2a42075e602611597f2486636929f0a128fc907f489d5"},"measurements":{"cached_input_tokens":4000,"cost":{"amount_micros":700000,"currency":"USD","status":"observed"},"input_tokens":8000,"latency_ms":790,"output_tokens":900,"status":"observed"},"role":"treatment","status":"complete"}},"quality":{"confidence":"high","control_score_milli":920,"evidence_refs":["id:sha256:a2f1f943b5f6c7f7b4f0ba6d1fec6e1134fc4f29bb9923cac2fadec8d79838a3"],"method":"automated","metric":"score_milli","status":"preserved","treatment_score_milli":920},"redaction":{"class":"metadata_only","notes":"Outputs are omitted; bounded metadata and digests remain.","policy":"content_minimization","reversible":false},"replay":{"determinism":"same_inputs_expected","input_refs":["id:sha256:9c8841eea94ae560ca549e5d514c003eb4e1349c748e6b85dc0725e6bee9363a"],"mode":"offline","notes":"Replay covers the recorded workload inputs and comparison metadata.","result_refs":["id:sha256:a9fb18a382eb328e79f067415aeabfcbf2a867dadc96bb6cf0fbb6bff0ddbe10"],"status":"partial"},"schema_version":"leanctx.customer-proof-evidence-bundle/v2","signing":{"algorithm":"Ed25519","key_id":"id:sha256:21fe31dfa154a261626bf854046fd2271b7bed4b6abe45aa58877ef47f9721b9","signature":"uLmFMOq7q+thUaNCddIJyCo39Rl9rST+Ira357lyA80ww4ExGYZjSbyPtTo7Ar43h0IM90EHYXedm4G8+vhGDw==","signed_digest":"sha256:39103457d3258ef407b0e06cad31978b318fff97ed16ff12d7664130c5788005","trust_basis":"out_of_band","trusted_signer_ref":"signer:id:sha256:21fe31dfa154a261626bf854046fd2271b7bed4b6abe45aa58877ef47f9721b9"},"status":"complete","subject":{"customer_ref":"customer:acme-labs","project_ref":"project:lean-ctx","workload_ref":"id:sha256:42d8afd8fea1184e1cb2a42075e602611597f2486636929f0a128fc907f489d5"}}